{
  "schema": "inside-valdivia.materialization-plan/1",
  "operation": "generate.from_references",
  "operation_version": 3,
  "operation_contract_hash": "479a9e932bc54b533b6f4db693433aeb20f626f4571459705921309cf590e771",
  "variant": "video-reference-with-guide",
  "topology_key": "generate.from_references@video-reference-with-guide",
  "priority": 20,
  "status": "offline-ready",
  "runtime_manifest_hash": null,
  "sources": { "workspace_export": null, "parameterization": null, "runtime_manifest": null, "operation_ref": null },
  "bindings": {
    "model_variant": "Ref2VA",
    "model_files": {
      "diffusion_model": "diffusion_models/minimax_h3_ref2va_pruned_fp8_scaled.safetensors",
      "text_encoder": "text_encoders/qwen3vl_32b_minimax_h3_nvfp4_awq.safetensors",
      "video_vae": "vae/minimax_h3_video_vae_fp16.safetensors",
      "audio_vae": "vae/minimax_h3_audio_vae_fp32.safetensors"
    },
    "resolution": [768, 1344],
    "target_frames": 124,
    "reference_image_size": "match",
    "reference_fps": 24,
    "reference_frames": 56,
    "temporal_guide_frame": 102,
    "prompt": null,
    "seed": null,
    "sampler": null,
    "scheduler": null,
    "steps": null,
    "video_shift": null,
    "audio_shift": null,
    "artifact": {
      "frame_rate": 24,
      "filename_prefix": null,
      "format": "auto",
      "codec": "auto",
      "history_resolvable": true,
      "retain_native_state": true
    },
    "inputs": { "reference_images": [null], "reference_clips": [null], "temporal_guide": null }
  },
  "outputs": { "ui_graph": null, "api_template": null, "bindings": null, "materialization_manifest": null, "ui_graph_hash": null, "api_template_hash": null, "bindings_hash": null },
  "validation": { "schema_status": "pending", "missing_node_types": [], "notes": ["Reference conditioning and AddGuide must remain on the same active positive-conditioning edge."] }
}
