{
  "schema": "inside-valdivia.materialization-plan/1",
  "operation": "continue.native_av",
  "operation_version": 3,
  "operation_contract_hash": "7990464810ab00136edadb5e3b5f624521fc70681c2fb4b803232ea5496be4cd",
  "variant": "keyframe-overlap",
  "topology_key": "continue.native_av@keyframe-overlap",
  "priority": 7,
  "status": "offline-ready",
  "runtime_manifest_hash": null,
  "sources": { "workspace_export": null, "parameterization": null, "runtime_manifest": null, "operation_ref": null },
  "bindings": {
    "model_variant": "FL2VA",
    "model_files": {
      "diffusion_model": "diffusion_models/minimax_h3_fl2va_pruned_int8_convrot.safetensors",
      "text_encoder": "text_encoders/qwen3vl_32b_minimax_h3_nvfp4_awq.safetensors",
      "video_vae": "vae/minimax_h3_video_vae_fp16.safetensors"
    },
    "resolution": [768, 1344],
    "overlap_frames": 22,
    "extension_frames": 119,
    "window_frames": 141,
    "prompt": null,
    "seed": null,
    "sampler": null,
    "scheduler": null,
    "steps": null,
    "artifact": {
      "frame_rate": 24,
      "filename_prefix": null,
      "format": "auto",
      "codec": "auto",
      "history_resolvable": true,
      "retain_native_state": true
    },
    "overlap_transport": "minimax_keyframes",
    "inputs": { "source_native_av_latent": null, "source_timeline_origin": 0 }
  },
  "outputs": { "ui_graph": null, "api_template": null, "bindings": null, "materialization_manifest": null, "ui_graph_hash": null, "api_template_hash": null, "bindings_hash": null },
  "validation": { "schema_status": "pending", "missing_node_types": [], "notes": ["22 and 141 are legal 17k+5 windows; the 119-frame suffix is a token-aligned 17k increment."] }
}
