{
  "schema": "inside-valdivia.materialization-plan/1",
  "operation": "regenerate.spatial",
  "operation_version": 1,
  "operation_contract_hash": "aa7e957f9156a8f1daead0ab3fc0ec2680b8d11f05957a4341bb9e945fd3e9d6",
  "variant": "pixel-vae-second-pass",
  "topology_key": "regenerate.spatial@pixel-vae-second-pass",
  "priority": 31,
  "status": "offline-ready",
  "runtime_manifest_hash": null,
  "sources": { "workspace_export": null, "parameterization": null, "runtime_manifest": null, "operation_ref": null },
  "bindings": {
    "model_variant": "FL2VA",
    "model_files": {
      "diffusion_model": "diffusion_models/minimax_h3_fl2va_pruned_fp8_scaled.safetensors",
      "text_encoder": "text_encoders/qwen3vl_32b_minimax_h3_nvfp4_awq.safetensors",
      "video_vae": "vae/minimax_h3_video_vae_fp16.safetensors"
    },
    "source_resolution": [768, 1344],
    "target_resolution": [1024, 1792],
    "target_frames": 124,
    "pixel_resize_method": "lanczos",
    "video_denoise": null,
    "characterization_values": [0.15, 0.25, 0.35, 0.5, 0.65],
    "audio_denoise": 0.0,
    "prompt": null,
    "seed": null,
    "sampler": null,
    "scheduler": null,
    "steps": null,
    "video_shift": null,
    "audio_shift": null,
    "artifact": { "frame_rate": 24, "filename_prefix": null, "format": "auto", "codec": "auto", "history_resolvable": true, "retain_native_state": true },
    "inputs": { "source_native_av_latent": null }
  },
  "outputs": { "ui_graph": null, "api_template": null, "bindings": null, "materialization_manifest": null, "ui_graph_hash": null, "api_template_hash": null, "bindings_hash": null },
  "validation": { "schema_status": "pending", "missing_node_types": [], "notes": ["Decode, resize pixels, re-encode with the H3 VAE, graft visual state, and characterize the same-H3 second pass against the latent variant."] }
}
