{
  "schema": "inside-valdivia.materialization-plan/1",
  "operation": "generate.with_guides",
  "operation_version": 2,
  "operation_contract_hash": "6aa98ac3795988f9797de0d5043505609fc7e86959b0da0832951ac3e535e3dc",
  "variant": "first-last-interior",
  "topology_key": "generate.with_guides@first-last-interior",
  "priority": 21,
  "status": "offline-ready",
  "runtime_manifest_hash": null,
  "sources": { "workspace_export": null, "parameterization": null, "runtime_manifest": null, "operation_ref": null },
  "bindings": {
    "model_variant": "FL2VA",
    "model_files": {
      "diffusion_model": "diffusion_models/minimax_h3_fl2va_pruned_fp8_scaled.safetensors",
      "text_encoder": "text_encoders/qwen3vl_32b_minimax_h3_nvfp4_awq.safetensors",
      "video_vae": "vae/minimax_h3_video_vae_fp16.safetensors"
    },
    "resolution": [768, 1344],
    "target_frames": 124,
    "prompt": null,
    "seed": null,
    "sampler": null,
    "scheduler": null,
    "steps": null,
    "video_shift": null,
    "audio_shift": null,
    "artifact": {
      "frame_rate": 24,
      "filename_prefix": null,
      "format": "auto",
      "codec": "auto",
      "history_resolvable": true,
      "retain_native_state": true
    },
    "inputs": {
      "first_frame": null,
      "last_frame": null,
      "guides": [{ "media": null, "frame_index": 62 }]
    }
  },
  "outputs": { "ui_graph": null, "api_template": null, "bindings": null, "materialization_manifest": null, "ui_graph_hash": null, "api_template_hash": null, "bindings_hash": null },
  "validation": { "schema_status": "pending", "missing_node_types": [], "notes": ["Retain both endpoint inputs and exactly one interior AddGuide node at frame 62."] }
}
