{
  "schema": "inside-valdivia.materialization-plan/1",
  "operation": "continue.native_av",
  "operation_version": 2,
  "operation_contract_hash": "2776bb1db0e844648bcb2b4d98a1ef84b36a2488449ef7bdc77d7e44ceb6a8b5",
  "variant": "masked-overlap",
  "topology_key": "continue.native_av@masked-overlap",
  "priority": 14,
  "status": "offline-ready",
  "runtime_manifest_hash": null,
  "sources": { "workspace_export": null, "parameterization": null, "runtime_manifest": null, "operation_ref": null },
  "bindings": {
    "model_variant": "FL2VA",
    "model_files": {
      "diffusion_model": "diffusion_models/minimax_h3_fl2va_pruned_fp8_scaled.safetensors",
      "text_encoder": "text_encoders/qwen3vl_32b_minimax_h3_nvfp4_awq.safetensors",
      "video_vae": "vae/minimax_h3_video_vae_fp16.safetensors"
    },
    "resolution": [768, 1344],
    "overlap_frames": 22,
    "extension_frames": 119,
    "window_frames": 141,
    "overlap_transport": "noise_mask",
    "target_frame_idx": 0,
    "mask": {
      "start_frame": 22,
      "frame_count": 119,
      "inside_strength_video": 1.0,
      "outside_strength_video": 0.0,
      "inside_strength_audio": 1.0,
      "outside_strength_audio": 0.0,
      "fade_in_frames": 0,
      "fade_out_frames": 0,
      "curve": "smoothstep",
      "combine": "replace"
    },
    "prompt": null,
    "seed": null,
    "sampler": null,
    "scheduler": null,
    "steps": null,
    "video_shift": null,
    "audio_shift": null,
    "inputs": { "source_native_av_latent": null, "source_timeline_origin": 0 }
  },
  "outputs": { "ui_graph": null, "api_template": null, "bindings": null, "materialization_manifest": null, "ui_graph_hash": null, "api_template_hash": null, "bindings_hash": null },
  "validation": { "schema_status": "pending", "missing_node_types": [], "notes": ["Place and preserve the 22-frame native tail; generate only the 119-frame suffix through the official nested AV mask path."] }
}
