{
  "schema": "inside-valdivia.materialization-plan/1",
  "operation": "regenerate.spatial",
  "operation_version": 2,
  "operation_contract_hash": "40a801bf58ab20e2757725f961298ba48078d241517f596c7215de4efe7e267d",
  "variant": "tiled-pixel-vae",
  "topology_key": "regenerate.spatial@tiled-pixel-vae",
  "priority": 32,
  "status": "offline-ready",
  "runtime_manifest_hash": null,
  "sources": { "workspace_export": null, "parameterization": null, "runtime_manifest": null, "operation_ref": null },
  "bindings": {
    "model_variant": "FL2VA",
    "model_files": {
      "diffusion_model": "diffusion_models/minimax_h3_fl2va_pruned_fp8_scaled.safetensors",
      "text_encoder": "text_encoders/qwen3vl_32b_minimax_h3_nvfp4_awq.safetensors",
      "video_vae": "vae/minimax_h3_video_vae_fp16.safetensors"
    },
    "source_resolution": [768, 1344],
    "target_resolution": [1024, 1792],
    "target_frames": 124,
    "pixel_resize_method": "lanczos",
    "tile_resolution": [768, 768],
    "tile_overlap": 128,
    "fusion_curve": "smootherstep",
    "video_denoise": null,
    "characterization_values": [0.15, 0.25, 0.35],
    "audio_denoise": 0.0,
    "prompt": null,
    "seed": null,
    "sampler": null,
    "scheduler": null,
    "steps": null,
    "artifact": { "frame_rate": 24, "filename_prefix": null, "format": "auto", "codec": "auto", "history_resolvable": true, "retain_native_state": true },
    "inputs": { "source_native_av_latent": null }
  },
  "outputs": { "ui_graph": null, "api_template": null, "bindings": null, "materialization_manifest": null, "ui_graph_hash": null, "api_template_hash": null, "bindings_hash": null },
  "validation": { "schema_status": "pending", "missing_node_types": [], "notes": ["Experimental VRAM-bounded path: hold a shared global prior and complete time window per overlapping spatial tile; reject if seam energy exceeds the full-frame baseline."] }
}
