{
  "schema": "inside-valdivia.materialization-plan/1",
  "operation": "restore.video",
  "operation_version": 2,
  "operation_contract_hash": "1d50897c535767b2757ef90dcbcc464b1c8afa808e416aa17ee2ce997fb4c078",
  "variant": "seedvr2-3b-nvfp4",
  "topology_key": "restore.video@seedvr2-3b-nvfp4",
  "priority": 31,
  "status": "offline-ready",
  "runtime_manifest_hash": null,
  "sources": { "workspace_export": null, "parameterization": null, "runtime_manifest": null, "operation_ref": null },
  "bindings": {
    "source_template": {
      "repository": "https://github.com/Comfy-Org/workflow_templates",
      "commit": "d11b69157009227ad2a7d3a927a1eb68a3d5f281",
      "path": "templates/utility_seedvr2_3b_int8_upscale_video.json"
    },
    "model_source": {
      "repository": "https://huggingface.co/Comfy-Org/SeedVR2",
      "revision": "673340c8a66db62b84e4099def7d01d337ae12dc",
      "license": "Apache-2.0",
      "diffusion_model": {
        "path": "diffusion_models/seedvr2_3b_nvfp4.safetensors",
        "sha256": "c8dea38b04d43295621726e2cd371c0d2d001006169c113aea17950f2cb2e295",
        "size_bytes": 1996687726
      },
      "vae": {
        "path": "vae/ema_vae_fp16.safetensors",
        "sha256": "20678548f420d98d26f11442d3528f8b8c94e57ee046ef93dbb7633da8612ca1",
        "size_bytes": 501324814
      }
    },
    "model_files": {
      "diffusion_model": "diffusion_models/seedvr2_3b_nvfp4.safetensors",
      "vae": "vae/ema_vae_fp16.safetensors"
    },
    "scale_multiplier": 1.5,
    "temporal_overlap": 2,
    "chunking_mode": "auto",
    "seed": null,
    "steps": 1,
    "cfg": 1.0,
    "sampler_name": "euler",
    "scheduler": "simple",
    "denoise": 1.0,
    "color_correction_method": "lab",
    "artifact": { "frame_rate": 24, "filename_prefix": null, "format": "auto", "codec": "auto", "history_resolvable": true, "retain_native_state": false },
    "inputs": { "source_video": null }
  },
  "outputs": { "ui_graph": null, "api_template": null, "bindings": null, "materialization_manifest": null, "ui_graph_hash": null, "api_template_hash": null, "bindings_hash": null },
  "validation": {
    "schema_status": "pending",
    "missing_node_types": [],
    "notes": [
      "Confirm native SeedVR2 object_info and both locked model hashes before download or queueing.",
      "The exact model-plus-VAE payload is 2,498,012,540 bytes before outputs.",
      "Assert unchanged frame count and 24 fps, then inspect detail gain, temporal shimmer, color drift, and chunk boundaries.",
      "The 1.5x scale is a conservative first characterization value, not an accepted production default."
    ]
  }
}
