{
  "schema": "inside-valdivia.materialization-plan/1",
  "operation": "generate.from_references",
  "operation_version": 2,
  "operation_contract_hash": "2981aea77eaaf6e83d0b0dace34c63ccd2816c13c27a622a8ab87c04fd4411ab",
  "variant": "image-reference-max",
  "topology_key": "generate.from_references@image-reference-max",
  "priority": 12,
  "status": "offline-ready",
  "runtime_manifest_hash": null,
  "sources": { "workspace_export": null, "parameterization": null, "runtime_manifest": null, "operation_ref": null },
  "bindings": {
    "model_variant": "Ref2VA",
    "model_files": {
      "diffusion_model": "diffusion_models/minimax_h3_ref2va_pruned_fp8_scaled.safetensors",
      "text_encoder": "text_encoders/qwen3vl_32b_minimax_h3_nvfp4_awq.safetensors",
      "video_vae": "vae/minimax_h3_video_vae_fp16.safetensors",
      "audio_vae": "vae/minimax_h3_audio_vae_fp32.safetensors"
    },
    "resolution": [768, 1344],
    "target_frames": 124,
    "reference_image_size": "max",
    "prompt": null,
    "seed": null,
    "sampler": null,
    "scheduler": null,
    "steps": null,
    "video_shift": null,
    "audio_shift": null,
    "inputs": { "reference_images": [null] }
  },
  "outputs": { "ui_graph": null, "api_template": null, "bindings": null, "materialization_manifest": null, "ui_graph_hash": null, "api_template_hash": null, "bindings_hash": null },
  "validation": { "schema_status": "pending", "missing_node_types": [], "notes": ["Compare only reference-image sizing against the match baseline; expect greater token and memory cost."] }
}
