{
  "schema": "inside-valdivia.materialization-plan/1",
  "operation": "generate.with_guides",
  "operation_version": 1,
  "operation_contract_hash": "dcc117fc281eddddc5568de0f7f55940c671b5bf6fedfb892514473eb77ead27",
  "variant": "multi-anchor",
  "topology_key": "generate.with_guides@multi-anchor",
  "priority": 6,
  "status": "offline-ready",
  "runtime_manifest_hash": null,
  "sources": { "workspace_export": null, "parameterization": null, "runtime_manifest": null, "operation_ref": null },
  "bindings": {
    "model_variant": "FL2VA",
    "model_files": {
      "diffusion_model": "diffusion_models/minimax_h3_fl2va_pruned_fp8_scaled.safetensors",
      "text_encoder": "text_encoders/qwen3vl_32b_minimax_h3_nvfp4_awq.safetensors",
      "video_vae": "vae/minimax_h3_video_vae_fp16.safetensors"
    },
    "resolution": [768, 1344],
    "target_frames": 124,
    "prompt": null,
    "seed": null,
    "sampler": null,
    "scheduler": null,
    "steps": null,
    "video_shift": null,
    "audio_shift": null,
    "inputs": {
      "guides": [
        { "media": null, "frame_index": null },
        { "media": null, "frame_index": null }
      ]
    }
  },
  "outputs": { "ui_graph": null, "api_template": null, "bindings": null, "materialization_manifest": null, "ui_graph_hash": null, "api_template_hash": null, "bindings_hash": null },
  "validation": { "schema_status": "pending", "missing_node_types": [], "notes": ["The canonical graph contains exactly two ordered MiniMaxH3AddGuide nodes."] }
}
