{
  "schema": "inside-valdivia.materialization-plan/1",
  "operation": "reference.transform",
  "operation_version": 1,
  "operation_contract_hash": "b8ab53d531135436b4d96a092a7466fd7ccf2bf9b8dcb19d119e96b1045a7126",
  "variant": "affine",
  "topology_key": "reference.transform@affine",
  "priority": 22,
  "status": "offline-ready",
  "runtime_manifest_hash": null,
  "sources": { "workspace_export": null, "parameterization": null, "runtime_manifest": null, "operation_ref": null },
  "bindings": {
    "frame_count": 124,
    "translation_x": 0.0,
    "translation_y": 0.0,
    "scale_x": 1.0,
    "scale_y": 1.0,
    "rotation_degrees": 0.0,
    "pivot_x": 0.5,
    "pivot_y": 0.5,
    "easing": "linear",
    "padding_mode": "border",
    "inputs": { "source_frames": null }
  },
  "outputs": { "ui_graph": null, "api_template": null, "bindings": null, "materialization_manifest": null, "ui_graph_hash": null, "api_template_hash": null, "bindings_hash": null },
  "validation": { "schema_status": "pending", "missing_node_types": [], "notes": ["This graph produces inspectable decoded reference media only; any later H3 use is a separate invocation and separate evidence claim."] }
}
